{
  "schema_version": 1,
  "session_id": "aaaaaaaa-aaaa-4aaa-8aaa-aaaaaaaaaaaa",
  "epoch": 1,
  "event_id": "bbbbbbbb-bbbb-4bbb-8bbb-bbbbbbbbbbbb",
  "seq": 1,
  "source_profile_id": "11111111-1111-4111-8111-111111111111",
  "logical_tab_id": "main",
  "frame_path": [],
  "route_key": "fixture.form",
  "route_generation": 1,
  "source_document_token": "master-document-demo-1",
  "type": "dom.click",
  "target": {
    "kind": "dom",
    "element_kind": "button",
    "candidates": [
      {
        "strategy": "testId",
        "value": "save-draft"
      }
    ]
  },
  "payload": {
    "button": "left",
    "modifiers": 0
  },
  "created_at": "2026-10-29T03:00:00Z",
  "ttl_ms": 5000,
  "trace_id": "cccccccc-cccc-4ccc-8ccc-cccccccccccc"
}
